review,word_count,text_length,cluster_label
ছবি যাই হোক ঠিক ছিলো কিন্তু গান গুলো মোটেই ভালো ছিলো না,12,55,0
সুপার হিট মুভি চ্যাম্পিয়ন,4,26,1
অভিনয়শিল্পীরা সত্যিই ভালো কাজ করেছেন। তাদের প্রত্যেকের অভিনয় চরিত্র অনুযায়ী মানানসই ছিল।,12,88,0
এসব সিনেমার জন্য আজকাল কেউ হলে যাওয়া দূর ঘরে বসেও বাংলা সিনেমা দেখতে চায়না,14,74,2
"সিনেমায় খুব আবেগ ছিল না, তবে হতাশাজনকও না।",8,42,0
সিনেমার সামাজিক বার্তা ভালো লেগেছে।,5,35,2
আলমগীর স্যার পুরাই স্যাভেজ বাংলা সিনেমা আসলেই সোনার টুকরো ছিলো এক সময় কাহিনি সবার সম্মিলিত বাস্তব সম্মত অভিনয় আর ক্যামেরা এংগেল সব মিলিয়ে প্রানবন্ত উপস্থাপন,25,156,1
"সিনেমার দৈর্ঘ্য কিছুক্ষেত্রে দীর্ঘ মনে হতে পারে, তবে গল্পের ধারাবাহিকতার জন্য যথেষ্ট।",12,85,0
"সিনেমায় একাধিক বিষয় ছুঁয়ে যাওয়া হয়েছে, কিন্তু গভীরে যাওয়া হয়নি।",10,63,0
এতো বাজে উচ্চারন ও নিম্নমানের অভিনয় জয়া আহসানের!!,8,49,1
সিনেমা দেখার সময় একটানা মনোযোগ ধরে রাখা একটু কঠিন ছিল।,10,54,0
পুরো সিনেমা জুড়ে খুব একটা আবেগ ছিল না।,8,38,0
পরিচালক গল্পের মূল ভাব সুন্দরভাবে তুলে ধরেছেন।,7,46,0
মুভিটির ভিজ্যুয়াল স্টাইল বেশ ইউনিক।,5,36,0
সিনেমার সেরা দিক ছিল এর সম্পূর্ণ মানবিক দৃষ্টিভঙ্গি।,8,52,0
"গানের সংখ্যা কম এবং গল্পের ফ্লোকে বাধা দেয়নি, ব্যাকগ্রাউন্ড মিউজিক গল্পের সঙ্গে মানানসই।",13,89,0
"সিনেমার শেষটা একটু হঠাৎ মনে হয়েছে, তবে মেনে নেওয়া যায়।",10,57,0
"শেষ পর্যন্ত দেখলাম, হতাশ হলাম না, খুশিও না।",8,43,2
অসাধারণ... কাদালো ও ভাবালো মুভি টা।। অসাধারণ অভিনয় সহম ও শ্রাবন্তী র।,12,70,2
"আমার দেখা একটি মন ছুয়ে যাওয়া মতো ছবি,,,সেটা হলো,,গহীন বালুচর,,,,,অসাধারন ছবিটা",14,78,1
সিনেমার বার্তা স্পষ্টভাবে বোঝা যায়নি।,5,37,0
ছবিটাতে ভিলেনের সংখ্যা বেশি।,4,28,1
"নির্মাতা কোনো ঝুঁকি নেননি, খুব নিরাপদ গল্প বলেছেন।",8,50,0
ছবি টি অভিনয় অসাধারণ হয়েছে তবে প্রকৃতিক এর দৃশ্য গুলো দেখার মতো,12,63,2
নামটা আবার কি?তার মানে এখানেও নকল,7,33,1
সত্যি অসাধারণ মুভিটা,3,20,2
"গল্পে কোনো জটিলতা ছিল না, আবার কোনো চমকও ছিল না। সিনেমার শেষে মনে হয়েছে, সময় নষ্ট হয়নি তবে কিছু শেখাও হয়নি।",21,107,0
"ডিরেকশনের স্টাইল ক্লাসিক, খুব আধুনিক বা ব্যতিক্রমী নয়।",8,55,0
সিনেমার থিম ও বার্তা অস্পষ্ট।,5,29,0
সিনেমাটা যতবার দেখি ততবারে চোখের পানি বের হয়,8,44,2
মুভিটি দেখার পর মনের শক্তি বেড়ে যায়।খুব সুন্দর একটি মুভি,11,58,2
এইসবও বুঝি সিনেমা? ভারতের মানুষের দারাই সম্ভব এমন সিনেমা বানানো,10,63,1
সিনেমার ক্লাইম্যাক্স অত্যন্ত আবেগপূর্ণ এবং স্মরণীয়।,6,52,0
অসাধারণ মুভি দেশের প্রতি মায়া বাড়ায় এমন ছবি,8,43,2
গানগুলো গল্পের ধারাকে পুরোপুরি ভেঙে দিয়েছে।,6,44,0
অ্যাকশন দৃশ্যগুলো খুবই ন্যাচারাল।,4,33,0
গল্পটা বাস্তবের খুব কাছাকাছি ছিল। তাই আরো ভালো লেগেছে।,9,54,0
"মুভির থ্রিলার বা সাসপেন্স অংশ সীমিত, তবে গল্পকে ধরে রাখতে যথেষ্ট।",11,65,0
"সিনেমার দিকনির্দেশনা খুব ক্লাসিকও না, মডার্নও না — মাঝখানে।",8,59,0
"সিনেমার গল্প একেবারেই ক্লিশে, নতুন কিছু দেখার আশা থাকলেও হতাশ হতে হলো।",12,70,0
"ছবির আবহাওয়া সাধারণ, নাটকীয়তা বা রোমাঞ্চ তেমন ছিল না।",9,53,0
সিনেমার শুরুতে কিছু অতিরিক্ত দৃশ্য ছিল যেগুলো বাদ দিলেও চলত।,10,60,0
এই মুভিটা অনেক আগে দেখছিলাম।আজ আবার দেখলাম।মুভিটা আমার খুব ভালো লাগে,13,68,2
আমাদের সিলেটের প্রাকৃতিক সৌন্দর্য এবং সিলেটি ভাষা আছে অনেক সুন্দর একটা মুভি,12,75,2
শেষ দৃশ্যে মন টা বেদনায় ভরে গেল। অসাধারণ অতুলনীয় একটা সিনেমা দেখলাম অনেক দিন পর। কি অপূর্ব অভিনয়,18,98,2
খুব উত্তেজনাপূর্ণ না হলেও পুরো মুভি জুড়ে ধারাবাহিকতা ছিল।,9,58,0
আমার দেখা সবচেয়ে ভালো শিক্ষনীয় সিনেমা এটা। সবচেয়ে বড় কথা সিনেমার সকল চরিত্রগুলো ছিলো অসাধারণ।,15,97,2
এগুলা কেন বানায় বুঝই না,5,23,1
"গানগুলো মোটামুটি, কোনোটাই আলাদা করে মনে থাকবে না।",8,49,0
সিনেমার ফাইনাল ক্লাইম্যাক্স খুব সরলভাবে উপস্থাপিত হয়েছে।,7,57,0
পরিবার বা সম্পর্কের বিষয়গুলো সংক্ষেপে দেখানো হয়েছে।,7,52,0
"সিনেমা যত এগোয়, ততই তার দুর্বলতা বাড়ে।",7,40,0
"আজকে সমাজের একি অবস্থা, কি শিখবে আমাদের বাচ্চারা",8,48,1
সিনেমার সাউন্ড ট্র্যাক খুব ভালো লাগলো।,6,38,0
কিছু অক্ষর সঠিকভাবে উপস্থাপন করা হয় না.,7,40,0
অসাধারণ লাগলো ছবি। কৌশিকী চক্রবর্তীকেও খুব ভালো লাগলো,8,53,2
সিনেমায় কোনো মেজর নেগেটিভ চরিত্র ছিল না।,7,40,0
কি থেকে কি পান্তা ভাতে ঘি,6,25,1
সুন্দর পারিবারিক ছায়াছবি। বাস্তবতার নিরিখে এই প্রস্তুতির জন্য লেখক ও পরিচালক কে অনেক ধন্যবাদ।,14,94,2
আলো এতই অদ্ভুত যে কয়েকটি দৃশ্যে চরিত্রগুলোকে ঠিকমতো দেখা যায় না।,11,66,0
"দারুণ গল্প,,,, বিদ্যাবলান মানেই অসাধারণ সিনেমা",6,46,1
কিছু দৃশ্যের সময় একটু বেশি টানা মনে হয়েছে।,8,44,0
"ব্যস্ততার মাঝে যখন মনটা খুব ক্লান্ত, আমি যদি আপনার সিনেমা দেখি, তাহলে মনটা এক মুহূর্তের মধ্যে ক্লান্তি ভুলে গিয়ে প্রশান্তি পায়।ধন্যবাদ বোন।",23,141,2
এগুলা দেখে বাংলা সিনেমার ওপর থেকে মন উঠে গেল,9,44,1
থিম ও বার্তা অস্পষ্ট।,4,21,0
"মুভি এমনই হওয়া উচিত যে খানে প্রকৃতির কথা, দেশের কথা, মাটির কথা বলবে। মুভিটা দেখে আমার ভালো লাগলো। ধন্যবাদ মির সাব্বির ভাইকে",22,123,2
আজগুবি চিন্তাভাবনার মুভি।,3,25,1
"গল্পের কাঠামো পরিচিত, কিন্তু একঘেয়ে নয়।",6,41,0
প্লট টুইস্টগুলো এত অনুমেয় ছিল যে চমকিত হওয়ার সুযোগই পেলাম না।,11,62,1
"গল্পে জটিলতার অভাব ছিল, কিন্তু গভীরতাও ছিল না।",8,46,0
"ভিলেন চরিত্র সীমিত প্রভাবশালী, তবে গল্পে প্রয়োজনীয়।",7,53,0
"গল্পটা খুব নতুন না, তবে উপস্থাপন ভিন্ন ছিল।",8,43,0
গল্পের শুরুটা ধীর হলেও শেষটা মোটামুটি ঠিকভাবে শেষ হয়েছে।,9,57,0
"নাটকীয়তা খুব একটা ছিল না, বরং একরকম সাদামাটা আবহে কেটে গেছে পুরো সিনেমা। মাঝে মাঝে দৃশ্যগুলো একঘেয়ে লেগেছে।",18,107,0
অনেক জায়গায় সিনেমা নিজেই নিজের সঙ্গে বিরোধিতা করেছে।,8,54,0
সত্যি আগের মুভির মতো এখন আর কোনো মুভি হবে না এক কথায় অসাধারণ,13,60,2
রানটাইম কিছুক্ষণ লম্বা মনে হলেও একঘেয়েমি লাগেনি।,7,49,1
মুভিটা দেখার পর মনটাই ভালো হয়ে গেল।,7,35,2
সত্যি ছবি খুব ভালো লাগছে এইরকম ছবি হয়ে না এখনো আর হয়ে না,13,56,2
গল্পের শেষটা খুব স্যাটিসফায়িং ছিল। এমনভাবে শেষ হয়েছে যে মনে হয়েছে ঠিক এটাই হওয়া উচিত ছিল।,16,89,0
গতি খুব মসৃণ না হলেও দেখা যায়।,7,31,0
এটি একটি মাস্টারপিস! আপনি যদি এটি দেখেন তবে আপনি সেই লোকদের মধ্যে হারিয়ে যাবেন।,14,80,1
"গল্পটা সোজা, সহজে বোঝা যায়।",5,28,0
স্ক্রিপ্ট ভালো হতো আরও একটু কাজ করলে।,7,37,1
"পুরো সিনেমাটি দেখে মনে হয়েছে বাংলা ইন্ডাস্ট্রি সত্যিই অনেক এগিয়েছে। প্রোডাকশন, অভিনয়, গল্প—সব দিক দিয়েই এটি একটি পরিপূর্ণ প্যাকেজ।",20,131,2
সিনেমার দৈর্ঘ্য একটু বেশি মনে হলেও সহনীয় ছিল।,8,46,0
গল্পটা ভালো লাগেনি,3,18,1
"বাংলার ইতিহাস কত সুন্দরভাবে তার ঐতিহ্যকে প্রকাশ করেছে। এমন সাংস্কৃতিক সামাজিক চলচ্চিত্র আজকাল দেখা যায় না। দুর্ভাগ্যবশত, আমরা অন্য দেশের সাথে তাল মিলিয়ে আমাদের নিজস্ব ইতিহাস ও সংস্কৃতি ভুলে যাচ্ছি।",30,199,2
পরিচালকের পরিচালনা সত্যিই প্রশংসনীয়। তিনি খুব সুন্দরভাবে গল্পটি দর্শকদের সামনে তুলে ধরেছেন। পুরো সিনেমায় কোন অপ্রয়োজনীয় দৃশ্য ছিল না।,19,137,0
এই ছবির নাম যেহেতু আসিফ আকবরের প্রথম এলবাম ও প্রিয়া তুমি কোথায় দেওয়া হয়েছে তাহলে শাবনুরের নামটাও প্রিয়া দেওয়ার দরকার ছিলো কেননা গানের সঙ্গে ব্যক্তির নামটাও মিল থাকা প্রয়োজন ছিলো,30,177,1
সিনেমায় মাঝে মাঝে সংলাপ ছাড়া কিছু মুহূর্ত দীর্ঘ মনে হয়েছে।,10,58,0
জায়েদ খান কে পাবনায় পাঠিয়ে দেওয়া হোক তারা সিনেমা করার দরকার নাই,12,67,1
গল্পের বার্তা এবং শিক্ষা খুব সুন্দরভাবে উপস্থাপন করা হয়েছে। দেখার পর মনে কিছু একটা থেকে যায়।,16,92,0
আরে আরে এসব কি ছিল,5,18,1
অভিনেতাদের কেমিস্ট্রি এতটাই সুন্দর ছিল যে বাস্তব মনে হয়েছে। বিশেষ করে সাপোর্টিং রোলগুলো অসাধারণ।,14,96,0
অভিনয়গুলো রুটিনের মতো লাগলো।,4,29,1
শেষটা কিন্তু ভালো লাগলো না,5,26,1
"সিনেমার গল্পটা ঠিকঠাক ছিল, কিন্তু খুব বিশেষ কিছু মনে হয়নি।",10,58,0
কিছু চরিত্রের বিকাশ পর্যাপ্ত নয়।,5,33,0
সিনেমার গল্পের গতি মাঝে মাঝে ধীর মনে হলেও চরিত্রগুলোর সংলাপ এবং দৃশ্যের বিন্যাস সহজে বোঝা যায়।,16,95,0
"কিছু সিকোয়েন্স বাস্তবসম্মত, কিছু খুব আর্টিফিশিয়াল।",6,50,0
"সিনেমাটি দেখতে পারলাম, বিশেষ কিছু মনে রইল না।",8,45,2
"ইতিহাসের পাতায় লেখা থাকবে আম্মাজান চলচ্চিত্র, প্রিয় নায়ক মান্না",9,66,1
আজকে বসে পুরোটা দেখলাম। সত্যি অসাধারণ! গল্পটা এত সুন্দরভাবে সাজানো যে চোখ সরানো যায় না।,15,87,2
বাপ্পি তুই চলচ্চিত্র ছেড়ে দারোয়ানী কর,6,39,1
"সিনেমার ভাষা প্রাঞ্জল ছিল, কঠিন কিছু না।",7,40,0
রসায়ন খুবই দুর্বল।,3,19,1
চরিত্রগুলোর গভীরতা নেই।,3,23,0
বাংলাদেশের চলচ্চিত্র ধংশ হয়ে গেছে ভালো হয়েছে,7,44,1
"সিনেমা মোটামুটি দেখার যোগ্য, বিশেষ চমক নেই। মিউজিক মানানসই।",9,59,0
জয়া আহসানের অতি অভিনয় বিরক্ত করেছে।,6,35,1
"চরিত্রগুলো একে অপরের সঙ্গে অদ্ভুতভাবে যোগাযোগ করেছে, বাস্তবতা নেই।",9,66,0
গল্পের ধারা অসম্পূর্ণ এবং দর্শককে হতাশ করেছে।,7,45,0
"ছবিগুলোর মধ্যে এমন কিছু আছে যা বছরের পর বছর দেখলেও দেখা শেষ হবে না ,এমনকি মন ভরবে না",18,84,1
সিনেমার চরিত্ররা অতিরিক্ত নাটক করে না।,6,38,0
"সিনেমার লাইটিং খুব নরম ও মনোমুগ্ধকর, যা পুরো গল্পকে উজ্জ্বল করেছে।",11,66,0
"মুভির কস্টিউমিং ঠিক আছে, কিন্তু নতুনত্ব ছিল না।",8,47,0
অনেক সুন্দর একটা সিনেমা। বাংলার ঘরে ঘরে বাস্তবিক জীবন ধারা তুলে ধরা হয়েছে,13,74,2
অন্য অনুভূতির ছোয়া চোখের সামনে এতক্ষণ কোন অভিনয় হচ্ছিল বোঝা গেল না। সব অভিনেতা অভিনেত্রীরা যেন জীবন্ত নিজের খেয়ালে এগিয়ে যাচ্ছে।,21,131,1
বাংলাদেশের লেক্ষকের প্রতি অনুরোধ অনন্যায়ের সাস্তি সাথে সাথে দিবে আবার নতুন তৈরি করবে আবার সাস্তি লিখবে,16,103,1
"মুভির থিম ছিল স্পষ্ট, তবে প্রভাব ফেলেনি।",7,40,0
সিনেমার প্রোডাকশন মান ঠিক আছে।,5,30,0
"সিনেমাটির শুটিং টেকনিক ভালো ছিল, কোনো নতুনত্ব ছিল না।",9,53,0
কিছু ডায়ালগ মনে গেঁথে গেছে।,5,27,1
"ছোট বেলায় শুধু শেষের অংশটুকু দেখতাম যুদ্ধের জন্য। আজ যখন ছবিটা দেখলাম তখন শেষের অংশে শুধু চোখের জলই ঝরল। মুক্তিযুদ্ধ সাহিত্যে শ্রেষ্ঠ উপন্যাস সেলিনা হোসেনের ""হাঙ্গর নদী গ্রেনেড""।",28,178,1
জয়ার অতি অভিনয় আর অতিরিক্ত কান্নাকাটি চিতকার চেচামেচির শব্দ দূষনের ভয়ে ওর নাটক সিনেমা দেখিনা। আজ দেখলাম টেনে টেনে।,19,114,1
এতো জঘন্য ছবি জীবনেও দেখিনি,5,27,2
"সিনেমার বার্তা ভালো, কিন্তু কিছু অংশ বোঝা কঠিন।",8,47,0
রুচির দুর্ভিক্ষ এখন সিনেমাতে স্থান পেয়েছে,6,41,1
"মুভির পেসিং খারাপ না, কিন্তু একটু আরও টাইট হতে পারতো।",10,53,0
"গল্পের কিছু অংশ কিছুটা বেশি সময় নিয়েছে, তবে সহনীয়।",9,50,0
"ভান্ডা গল্প, চিত্রনাট্য, সকলের আশ্চর্যজনক অভিনয়, আশ্চর্যজনক গান, এবং কুংফু নাচের জন্য একটি সুপার হিট ছিল। অ্যাকশন এবং রোমান্স উভয় দিক থেকেই ভান্ড বাংলাদেশের অন্যতম সেরা উপার্জনকারী চলচ্চিত্র।",28,193,1
থিম এবং বার্তা দর্শকদের স্পর্শ করে না।,7,38,0
"যারা বলেছিলেন সিনেমাটা ভালো, তারা সত্য কথা বলেছে। আমি ভীষণ উপভোগ করেছি। আবার দেখতে ইচ্ছে করছে।",16,94,2
"সামগ্রিকভাবে মুভিটা একবার দেখে নেওয়া যায়—না হতাশ করে, না খুব মুগ্ধ করে।",13,73,0
চরিত্রগুলোর আবেগ দর্শকের কাছে পৌঁছায়নি।,5,40,0
সিনেমা দেখা বিরক্তিকর নয় এবং খুব উত্তেজনাপূর্ণ নয়।,8,52,0
"কি বলবো। এখনো এই ছবি টা অনেকের চোখে পানি এনে দেয়,যাদের মা বাবার প্রতি ভালোবাসা আছে",17,83,1
কিছু মানুষ আছে এদের জ্ঞান আক্কেল কখনোই হবে না তাইতো এই ধরনের মুভি বানাতে পারছে,15,78,1
"সিনেমা দেখে মনে হয়েছে, আরেকদিন দেখতে পারি এমন কিছু।",9,51,2
"সিনেমার সেট ডিজাইন সুন্দর, তবে চিত্রনাট্য দুর্বল।",7,49,0
চরিত্ররা যেভাবে তাদের আবেগ প্রকাশ করে তা অবাস্তব এবং অতিরঞ্জিত।,10,63,0
সিনেমায় গল্পের গভীরতা না থাকলেও ফাঁকা মনে হয়নি।,8,47,0
"ব্যাকগ্রাউন্ড সাউন্ড গল্পের সঙ্গে মানানসই, কোনো ঝাঁকুনি বা অতিরিক্ত চাপ নেই।",11,76,0
সিনেমার চিত্রনাট্য একেবারে গড়পড়তা ছিল।,5,38,0
"ভিজ্যুয়াল কিছু দৃশ্যে আকর্ষণীয়, কিছুতে সাধারণ।",6,48,0
একটি অবিশ্বাস্য সুন্দর সিনেমা বর্ণনা করার জন্য কোন শব্দ নেই,10,59,2
এসব আটার বস্তার সিনেমা মানুষ দেখেনা,6,35,1
সিনেমার আবহ এবং সাউন্ড ডিজাইন অভিজ্ঞতাকে আরও উন্নত করেছে।,9,57,0
শারুখ এর মুভি থেকে এইটা আশা করা যায় না,9,38,1
এমন মুভি দেখার থেকে ঘুমানো ভালো,6,31,2
