review,word_count,text_length,cluster_label
"ছোটবেলায় এই মুভিটা আমার খুব ভালো লাগতো, আমি ইন্ডিয়া থেকে এসেছি। আমি পশ্চিমবঙ্গে থাকি। আমি আজ এগারো বছর পর এই মুভিটা দেখছি। খুব খুশি লাগছে।",25,140,2
এতো সুন্দর সিনেমা। দেখেই মন টা ভরে গেলো। মনে হলো ৩ ঘন্টা সময় খুব সুন্দর কাটলো।,16,79,2
গল্পটা বাস্তবধর্মী না হলেও ভয়ংকর অযৌক্তিকও লাগেনি।,7,51,0
"গল্পের সূচনা থেকে শেষ পর্যন্ত কোনো হঠাৎ উত্তেজনার পরিবর্তন নেই, সব কিছু নিয়মিত ধারা বজায় রেখেছে।",16,98,0
ওমর সানি একটা তাং ফাং নায়ক এই সব অভিনয় ইলিয়াসকাঞ্চন হোলে ফুটে উঠতো,13,66,1
শাকিব ভাইয়ার অভিনয় অসাধারণ সুন্দর হয়েছে যা ভাষায় প্রকাশ করা যায় না,12,66,1
গল্পের থিম শিক্ষণীয় এবং প্রেরণামূলক।,5,37,0
বিবেক অগ্নিহোত্রী বহুদিন বাদে গুরুত্বপূর্ণ চরিত্র পেয়েও নজর কাড়তে ব্যর্থ।,10,74,1
"মুভির পোশাক, সেট ডিজাইন এবং কালার টোন খুবই আকর্ষনীয়। পুরো সময় চোখ ঝিমঝিম করে।",14,79,0
অনন্ত ছাড়া বাকি সব ভালো লাগছে। তার সংলাপ শুনলে আমার হাসি পায়,12,60,1
"কতো সুন্দর বাংলা ছায়াছবি মা,বা,ভাই বোনকে নিয়ে দেখার মতো সিনেমা",12,62,1
গল্পের টুইস্টগুলো খুব স্মার্টলি দেওয়া হয়েছে।,6,44,0
গল্পের মোড়ানো মুহূর্তগুলো অসম্পূর্ণ।,4,37,0
"চরিত্রগুলোর অভিনয় স্বাভাবিক, কেউ অতিরিক্ত প্রশংসাযোগ্য নয়, আবার কেউও মনে রাখার মতো খারাপ নয়, যা পুরো সিনেমার ভারসাম্য বজায় রাখে।",20,132,0
গল্পের মোড়চুয়ানো দৃশ্য মনে থাকবে।,5,35,1
এইটা কি নাইকা?,3,14,1
"সিনেমা দেখতে দেখতে সময় কেটে গেছে, বিশেষ কিছু মনে হয়নি।",10,56,2
একপ্রকার অবাক হয়ে গেলাম এত সুন্দর একটা সিনেমা,8,45,2
ভালো লাগছে অনেক,3,15,1
টাকা খরচ করে মানুষ এরকম ফালতু ছবি কি করে বানায়,10,47,1
সিনেমার আবেগপূর্ণ মুহূর্তগুলোও খুব জোর করে ঢোকানো মনে হয়েছে।,9,61,0
একদম ফালতু ফাইট সিন,4,19,1
আসলেই দেব চ্যালেঞ্জ না নিলে আমরা ককপিট নামক এমন একটি সুন্দর মুভি উপভোগ করতে পারতাম না। দেব আসলেই সেরায় সেরা,20,108,1
বাপরে বাপ। মাথা ঘুরে গেলো।,5,26,1
"চরিত্রগুলোর অভিনয় মোটামুটি, কেউ অতিরিক্ত ভালো না হলেও খারাপও নয়।",10,66,0
না খুবই হতাশ। একটু আশা করিনি যে মুভিটা এরকম নিরাশা করবে,11,55,2
"অল্পতেই সাধারণ, বে খেয়াল হলেও বুঝতে দেরি করে ফেলেছি।যা প্রতিটা মানুষের মাঝে বিদ্যামান।",14,86,1
গল্পের থিম অনুপ্রেরণামূলক।,3,26,0
কমেডিয়ান হিরো আলমের মুভি জীবনের প্রথম বার দেখলাম শুধু ঘুম নষ্ট করার জন্য,13,72,1
সিনেমার লাইটিং অনেক দৃশ্যেই চোখে ভীষণ কষ্ট দেয়।,8,48,0
"সিনেমার থিম বেশ সাধারণ, নতুনত্ব কম।",6,35,0
অনেক সংলাপ অসংলগ্ন এবং বিরক্তিকর।,5,33,1
বেশ সুন্দর একটা সিনেমা! আবীর-রাইমার কেমিস্ট্রি চমৎকার। রাইমা যে কী সুন্দর!,12,74,1
নায়কের এনার্জি পুরো সিনেমা জুড়েই ছিল।,6,37,0
ড্রামার জায়গাগুলো একটু হালকা ছিল।,5,33,0
এইরকম সিনেমা এখন বিলুপ্ত।,4,25,2
"মূল প্লট বোঝা সহজ, কোনো জটিলতা নেই।",7,35,0
বাংলা মুভি দেখা হয়না কিন্তু এই মভি টা রাত জেগে দেখলাম অনেক ভালো লাগলো।,14,70,2
"গল্পের ভিলেন খুব দুর্বল, ভয়ের কোনো অনুভূতি নেই।",8,48,0
পরিচালনার মান মাঝারি পর্যায়ের ছিল।,5,35,0
গল্পের গতি অনেক সময় ধীর হলেও সহনীয় ছিল।,8,41,0
মোটামুটি ঠীক আছে,3,16,1
জায়েদ খান একটা টিয়ুব লাইট,5,25,1
গল্পের টুইস্ট এতই দুর্বল যে আগেই বোঝা যায় কী হতে যাচ্ছে।,11,57,0
"গল্পের পেস মাঝারি—কিছুক্ষেত্রে ধীর, কিছুক্ষেত্রে দ্রুত। তাই প্রথম থেকে শেষ পর্যন্ত দেখতে ধৈর্য ধরে রাখা যায়।",17,109,0
"ছবির ভিজ্যুয়াল ইফেক্ট সীমিত ছিল, কিন্তু কাজ চালানোর মতো ছিল।",10,61,0
"ফালতু একটা মুভি, জিতের এই প্রথম দেখলাম,, সাথী, সঙ্গী, আওয়ারা, হানডেট পারসেন লাভ, জোশ, জোর, ওয়ান্টেড, হিরো, দিওয়ানা, বস, নাটের গুরু, সাত পাকে বাঁধা, বন্ধন, , পাওয়ার, চ্যাম্পিয়ন, এগুলোই ছিল তার বেস্ট মুভি জিতের",33,213,1
"ছোট্ট ছেলেটার অভিনয় খুব সুন্দর হয়েছে, খুব মায়াবী চেহারা, প্রবাস জীবনে এসে, এমন মায়াবী চেহারা দেখে, সত্যিই বুকটা ফেটে কান্না আসে।",21,132,1
মেকআপের নামে যে সব পাউডার লাগানো হয় তা মুখে দেখা যায়,11,54,1
"এমন অসাধারণ অভিনয় একমাত্র মহান নায়ক স্যার সালমান শাহের দ্বারাই সম্ভব।আমি চোখের পানি ধরে রাখতে পারিনি।ছবিটি অনেকবার দেখেছি,তবে ভবিষ্যতে দেখব।",23,142,2
বাংলাদেশের শ্রেষ্ঠ ছবি বেদের মেয়ে জোসনা এই ছবি আমার ছবি দেখে শেষ করা যাবেনা শুধু বাংলাদেশ না সারা বিশ্বের শ্রেষ্ঠ ছবি সারা বিশ্বের শ্রেষ্ঠ ছবি বেদের মেয়ে জোসনা সাথে কোন ছবি তুলনা হয়না,33,186,1
সিনেমার এফেক্টস চোখ ধাঁধাঁয়ানো।,4,32,1
গল্পের ভেতর থাকা সমস্যাগুলোকে গুরুত্ব দেওয়ার বদলে ফালতু নাটকীয়তা দেখানো হয়েছে।,11,81,1
পরিবার নিয়ে দেখার মতো সুন্দর একটা সিনেমা।,7,41,2
"সাপোর্টিং চরিত্রগুলো গল্পে উপস্থিত ছিল, কিন্তু খুব বেশি প্রভাব ফেলেনি।",10,70,0
আগের ছবির তুলনাই হয় না আগের ছবি গুলো সত্যি খুব সুন্দর ছিল,12,57,2
বাংলা সিনেমায় এমন ক্রিস্প স্ক্রিপ্ট অনেকদিন দেখি না। খুব ভালো লেগেছে।,11,69,2
মুভি গড় মানের।,3,15,2
নকল করলে কেউ পুরাটাই করে নাকি!,6,30,1
সব মিলিয়ে একবার দেখা গেলেও মনে দাগ কাটে না।,9,44,1
বাহ! এই সিনেমা দেখে অনেক কিছু শেখার রয়েছে,8,41,2
কি মুভি দেখলাম ভেবেই পাচ্ছিনা ল্যাওড়া,6,37,2
"গানগুলো ঠিক ছিল, মনে রাখার মতো নয়।",7,35,0
"গল্পে হালকা রোম্যান্স আছে, তবে খুব গভীর না।",8,43,0
গল্পটা সত্যিই টানটান আর আবেগী ছিল।,6,34,0
সিনেমাটি বাস্তবভিত্তিক হলেও মন ছুঁয়ে যায়নি।,6,43,0
সিনেমায় গল্প বলার ধরণটি সাধারণ ছিল।,6,35,0
"কাহিনি আগাতে সময় নিয়েছে, কিন্তু বিরক্ত করেনি।",7,47,0
আহা যেমন গল্প তেমন অভিনয়।,5,25,1
ওমর সানি একজন নায়ক,4,19,1
"মুভিটির গল্প খুবই ক্লিচ এবং বোরিং, শুরু থেকেই কোন নতুনত্ব নেই।",11,62,0
গল্পের কোনো নির্দিষ্ট গন্তব্য নেই।,5,34,0
"এটি একটি চমৎকার পারিবারিক গল্প ছিল৷ আবেগ, হাসি এবং কিছু সুন্দর মুহূর্ত — সব মিলিয়ে একটি ঝরঝরে মুভি৷",17,100,2
সিনেমাটি দেখার পরে খুব বেশি কিছু মনে থাকেনি।,8,44,2
"পুরো মুভি জুড়ে ধারাবাহিকতা ছিল, যদিও বেশি উত্তেজক না।",9,54,0
"চরিত্রের মৃত্যু বা বড় ঘটনা দেখানো হয়েছে খুবই কাঁচাভাবে, কোনো আবেগ নেই।",12,72,0
"গল্পটা অলসভাবে বলা হয়েছে, কোনো তাড়াহুড়ো নেই, কোনো গতি নেই।",10,61,0
"ক্যামেরার কাজ কিছুটা ভাল, কিছুটা সাধারণ।",6,40,0
সিনেমার ফিনিশিং দৃশ্যটা মোটামুটি ঠিক ছিল।,6,41,0
"ব্যাকগ্রাউন্ড মিউজিক গল্পের সঙ্গে মানানসই, কোনো জোর বা অপ্রয়োজনীয় চাপ নেই।",11,76,0
ব্যাকগ্রাউন্ড সাউন্ড এত অপ্রয়োজনীয় জায়গায় জোর করেছে যে বিরক্তি ধরেছে।,10,73,1
সিনেমার গল্পটা সুন্দর,3,21,2
এই মুভিটি আশ্চর্যজনক মুভিগুলোর একটি,5,35,2
বমি আসলো দেখে,3,13,1
"সিনেমার লোকেশন ছিল পরিচিত জায়গা, সেট ভালো লেগেছে।",8,49,0
অসম্ভব সুন্দর একটি মুভি বলার ভাষা নেই এক কথায় অসাধারণ,10,54,2
"সত্যি বলতে কাঙ্গনা রানাউত এর কোনো মুভিই আমি দেখিনি।তবে তার এই মুভির মধ্যের অংশের ছোট্ট একটা ক্লিপ দেখেছিলাম অনেক আগে।অনেক সার্চ করেও পাইনি।আজ মুভিটা সম্পুর্ন দেখে খুব ভালো লাগলো। এবং কাঙ্গনার একজন ভক্ত হয়ে গেলাম।এই অশ্লীলতার যুগেও এতো সুন্দর স্ক্রিপ্ট এক্সেপ্ট করার জন্য তাকে স্যালুট জানাই।ভালো গল্প,স্ক্রিপ্ট হলে যেকোনো ছবিই দেখতে ভালো লাগে।",59,342,2
"কিছু দৃশ্য স্বাভাবিকভাবে কাজ করে, কিন্তু কিছু অতিরিক্ত।",8,55,0
"হিরোর অতিরিক্ত হিরোগিরি দেখে বিরক্ত লেগেছে, কোনো বাস্তবতা নেই।",9,62,1
ক্লাইম্যাক্স হঠাৎ এবং অসম্পূর্ণ।,4,32,1
আমি মেয়েদেরকে নিয়ে খুব তিক্ত বিরক্ত এরকম কোমর দোলানো ছাড়া আর কোন কিছুই পারে না,15,81,1
সিনেমা টা দেখে মনের জোর বাড়ে। অনেক সুন্দর একটা সিনেমা,10,53,2
চরিত্রগুলোর গভীরতার অভাব রয়েছে।,4,32,0
সত্যিই চোখের পানি ধরে রাখতে পারলাম না,7,37,1
গল্পের মোড় অত্যন্ত চমকপ্রদ।,4,28,0
থিমটা পুরনো মনে হলেও পরিবেশন ভিন্ন ছিল।,7,39,0
কিছু ছবি তৈরি হয় শুধুমাত্র বক্স অফিসের লড়াইকে জিতে অর্থলাভ করার জন্য।,12,70,1
গল্পে কোনো মৌলিকত্ব নেই; পুরনো ধারণা আর ক্লিশে সংলাপের মিশ্রণে পুরো সিনেমা যেন একটা দীর্ঘ বিরক্তিকর অভিজ্ঞতা হয়ে দাঁড়িয়েছে।,19,126,0
অসাধারণ একটা রিয়াজ ভাই বাংলা মুভি,6,34,1
এটা কোন দেশের ছবি এটা আমার উত্তম কুমার ওই আমলের ছবি মনে হচ্ছে আমার বাটন ফোনের ক্যামেরা দিয়ে একটা ছবি করবো ছবির নাম,23,115,2
কিছু দৃশ্য এতটাই অপ্রয়োজনীয় যে কেটে দিলে গল্প আরও ভালো হতো।,11,61,0
ছবিটা অনেক অদ্ভুত কারণ হলো অর্ধনারী যদি ছেলে হয় তাহলে জেলের ভিতরে কসটিউম কি করে ধরে রেখেছে জেলের ভিতরেও কি পার্লার আছে নাকি বুঝলাম না কাদের এই জিনিসটা মনে হয়েছে সাড়া দাও,32,172,1
খুব সুন্দর একটি ছবি।যারা দেখেননি তাদের দেখার জন্য অনুরোধ করা হলো।,12,65,2
মুভি টা চাইলে আরো ভালো করতে পারতো।এলোমেলো কাহিনী পুরা,10,53,2
হাস্যরস স্বাভাবিক এবং গল্পের সাথে সামঞ্জস্যপূর্ণ।,6,49,0
"হিরোর ওভার-দ্য টপ হিরোইজম দেখে ক্লান্ত, বাস্তবতা নেই।",9,53,1
সিনেমার ভিএফএক্স খুব সাধারণ ছিল।,5,32,0
এক কথায় দারুণ,3,14,1
"সাসপেন্স অংশটি এতটা গভীর নয়, তবে যা আছে তা সঠিক মনে হয়।",12,57,0
সিনেমার সবচেয়ে উত্তেজনাময় মুহূর্তটিও বোরিং হয়ে গেছে খারাপ এডিটিংয়ের কারণে।,10,78,0
সিনেমায় রোমান্স এবং বন্ধুত্ব দুটোই হালকা রকমে ছিল।,8,50,0
"গানের সংখ্যা কম, যা ছিল সেগুলো গল্পে বাধা হয়ে দাঁড়ায়নি।",10,55,0
এডিটিং এত স্মুথ ছিল যে সময় কিভাবে চলে গেছে বুঝতেই পারিনি।,11,57,0
গানগুলো এমন হঠাৎ করে চলে আসে যে গল্পের গতি ব্যাহত হয়।,11,54,0
কি ভাবলাম আর কি দেখলাম,5,22,2
সিনেমার রোমান্টিক মুহূর্তগুলো হালকা এবং প্রয়োজনীয় মাত্রার মধ্যে আছে।,9,70,0
হালকা কমেডি আর আবেগের মিশ্রণটা ভালো ছিল।,7,40,0
সিনেমা একবার দেখা গেলেও আবার দেখার দরকার নেই।,8,45,2
"অসাধারণ, রোমান্টিক,মেলডি মুভি",4,29,2
এর চেয়ে যাত্রা ভালো,4,20,1
"ছোটবেলায় আমি শুধু যুদ্ধের শেষ অংশ দেখেছি। আজ যখন ছবিটি দেখলাম, তখন শুধু শেষ অংশটুকুই চোখে পানি এনেছে। মুক্তিযুদ্ধের সাহিত্যের সেরা উপন্যাস সেলিনা হোসেনের ""হাঙ্গর নদী গ্রেনেড""।",27,176,2
অবিশ্বাস্য সুন্দর ছবি সুন্দর গল্প অসাধারণ অভিনয় পরিচালক কে অনেক ধন্যবাদ তারাব রুপগনজ নারায়ণগঞ্জ বাংলাদেশ থেকে,16,111,1
মুভির ব্যাকগ্রাউন্ড মিউজিক অসাধারণ ছিল। আবেগী দৃশ্যগুলো আরও জীবন্ত মনে হয়েছে মিউজিকের কারণে।,13,92,0
নাম্বার ওয়ান কমেডিয়ান,3,23,1
অনেক দৃশ্যেই বাস্তবতা অনুপস্থিত।,4,32,0
বাংলাদেশের ব্যবসাসফল সিনেমা এটি,4,31,1
"সিনেমার প্রতিটি দৃশ্য সুন্দরভাবে সাজানো, চোখ সরানো যায় না। গল্পের বার্তা খুবই ইতিবাচক এবং মানবিক। চরিত্রদের মধ্যকার সম্পর্ক, বন্ধুত্ব এবং ভালোবাসার মুহূর্তগুলো দর্শকের সাথে সহজেই সংযোগ স্থাপন করে। এটি একটি এমন সিনেমা যা দেখা শেষে মনকে শান্তি ও আনন্দ দেয়।",40,256,0
এইটা মাস্টারপিস! এটা দেখতে বসলে সেই মানুষ গুলোর মাঝে আপনিও হারিয়ে যাবেন।,12,72,1
পারিবারিক বা সম্পর্কের সমস্যাগুলো সংক্ষেপে দেখানো হয়েছে।,7,57,0
অনেকদিন পর এমন একটা সাধারণ মুভি দেখলাম।,7,39,2
"দুর্দান্ত, দুর্দান্ত, দুর্দান্ত, অনেক দিন পরে, আমি ভাল অভিনীত, অনবদ্য সংলাপে পূর্ণ একটি গল্পের সন্তোষজনক সমাপ্তি উপভোগ করেছি।",18,125,2
"গল্পের গতি মাঝেমাঝে ধীর ছিল, তবে সহ্যযোগ্য।",7,43,0
সিনেমার আবেগ দর্শকের কাছে পৌঁছায়নি।,5,36,0
সত্যিই জাতীয় পুরস্কার পাওয়ার মতো মুভি,6,39,1
"কিছু দৃশ্য দীর্ঘ, কিন্তু সহনীয়।",5,32,0
চরিত্রদের সম্পর্কগুলো ঠিকমতো বোঝানো হয়েছে।,5,43,0
কোনো চরিত্রই বিশ্বাসযোগ্য মনে হয়নি।,5,36,0
ছোটবেলায় মহাদেবপুর বুলবুল মুভি দেখেছিলাম।এটি একটি খুব সুন্দর চলচ্চিত্র ছিল,11,75,2
মিশার চরিত্রটা ভালো লাগছে কিন্ত নায়িকা ভালো হয়নাই,8,49,1
"সিনেমার গতিপথ ধরে রাখা হয়েছে, চমক কম।",7,38,0
"সিনেমার থিম একেবারে সাধারণ ছিল, জটিল কিছু না।",8,45,0
গল্পের ধারাবাহিকতা মোটামুটি বজায় ছিল।,5,38,0
"ক্যামেরা শটগুলো অনেক জায়গায় অদ্ভুত, চোখে লাগে।",7,48,1
অনন্ত জলিল কে দেখলেই হাসি পায়। মনে হয় খুব কষ্ট করে অভিনয় করে,13,60,1
"ভিজ্যুয়াল মান ভালো হলেও গল্পের কোনো ভিত্তি ছিল না, সবই শূন্যতার ওপর দাঁড়ানো।",13,78,0
সাপোর্টিং রোলগুলো মোটামুটি কাজ করেছে।,5,37,1
সিনেমার আবহ তৈরি করার কোনো চেষ্টা চোখে পড়েনি।,8,46,0
মুভির প্রথমার্ধ কিছুটা বিভ্রান্তিকর কিন্তু ধীরে ধীরে পরিষ্কার হয়ে যায়।,10,72,0
মুভি দেখার অভিজ্ঞতা খুব ভাল বা খুব খারাপ নয় - গড় মানের।,11,57,0
অসাধারণ সিনেমা বার বার দেখার পরও। আবার নতুন মনে হয়।,10,52,2
খুব একটা ভালো লাগে নাই।,5,23,1
পুরাই বাজে জঘন্য মুভি অযথায় সময় নষ্ট না করে কেটে পড়ুন,11,56,1
ভিলেনের চরিত্রও অনেক শক্তিশালী ছিল।,5,35,0
