review,word_count,text_length,cluster_label
একেবারেই সাধারণ মানের গল্প। জয়া এইরকম সাধারণ মানের গল্পে অভিনয় করতে পারে ভাবায় যায়না। ওপার বাংলা থেকে ডাক এলেই ধেং ধেং করে যেতে হবে এর কোন মানে নেই।ছিঃ,29,151,1
একজন জাজ কখনোই একজন উকিল এর ব্যাক্তিগত ব্যাপারে সবার সম্মুখে হেও করা কোন ভাবেই ঠিক নয়। এটা পরিচালক এর অদক্ষতার প্রমানও বটে।,22,123,1
অনেক সুন্দর মুভি রিয়ায ভাই এবং সাকিব খান শাবনূর আপু অভিনন্দন তোমাকে,12,68,1
"সিনেমার গল্প মোটামুটি সরল। শুরুতে কিছুটা আকর্ষণ আছে, তবে মাঝের অংশে টেম্পো ধীর মনে হয়েছে। চরিত্রগুলো ঠিক আছে, কিন্তু সব চরিত্রের জন্য যথেষ্ট সময় দেওয়া হয়নি। প্রোডাকশন এবং ভিজ্যুয়াল মান ঠিকঠাক। মিউজিক গল্পের সঙ্গে মানানসই, তবে বিশেষ আবেগ সৃষ্টি করেনি। সংলাপ সাধারণ, মোটামুটি একবার দেখার মতো সিনেমা।",47,302,0
"বেশি ভালো না,,, তবুও দেখলাম,,",5,29,1
"ভালো লাগলো , শাশুড়ি বৌমার হৃদয় বিদারক সংগ্রামের মন ছুঁয়ে যাওয়া গল্প।",11,68,1
ইতিহাসের সেরা মুভীর একটি যা ভারত বা বাংলাদেশে আর কোনদিন হবেনা এমনকি মিঠুন চক্রবর্তী দাদার মতোন সুপার নায়কও একটি আসবেনা তাই নতুন করে আজকে আবারও এই মুভিটি দেখলাম,28,159,1
মদ সিগারেট খাওয়া ভালো কোনদিকে,5,29,1
সিনেমার সংলাপগুলো খুব প্রাঞ্জল ও মজাদার।,6,40,0
"ক্লাইম্যাক্সটা ঠিকঠাক হয়েছে, কিন্তু জোরালো ছিল না।",7,51,0
পুরো সিনেমা জুড়ে কৃত্রিম নাটকীয়তা এত বেশি যে সেগুলো আলাদা করে চোখে লাগে।,13,74,1
গল্পের টার্নিং পয়েন্টগুলি এত সুন্দরভাবে সাজানো হয়েছিল যে উত্তেজনা বজায় ছিল।,11,78,0
সিনেমার সাউন্ড কোয়ালিটি ঠিকঠাক ছিল।,5,35,0
প্রতিটা চরিত্র খুব সুন্দরভাবে গড়ে তোলা হয়েছে।,7,45,0
একদম সময় নষ্ট কেউ দেখবে না এ ধরনের মুভি,9,40,2
থিম দর্শককে কোনো বার্তা দেয়নি।,5,31,0
ক্রঞ্জের থেলায় মরে গেলাম,4,24,1
"গল্পের কাঠামো ঠিক ছিল, কিন্তু চমকপ্রদ না।",7,41,0
সব থেকে বাজে জটায়ু করেছিলেন অনুপকুমার।অত ভালো একজন অভিনেতা আর তার এতো বাজে কাজ।।,15,80,1
গল্পের ক্লাইম্যাক্স মনে রাখার মতো।,5,34,1
সিনেমায় আলাদা করে মন ছুঁয়ে যাওয়া মুহূর্ত না থাকলেও কিছু কিছু দৃশ্য ভালো লেগেছে।,14,79,0
"মূল কনফ্লিক্ট সহজবোধ্য এবং দর্শকের জন্য বোঝা সহজ, কোনো অতিরিক্ত জটিলতা বা নাটকীয়তা নেই।",14,88,0
"একবার দেখার মতো, তবে বারবার দেখতে ইচ্ছে হবে না।",9,47,2
"কিছু দৃশ্য দীর্ঘ, তবে সহনীয়।",5,29,0
"গল্পের ফ্লো পুরো সময় ধরে ধীর এবং নিয়ন্ত্রিত, হঠাৎ উত্তেজনা নেই।",11,65,0
অনেক দিন পর একটা বাংলা ছবি পুরোটা দেখলাম।খুব ভালো লাগলো এবং চোখেও জল এসে গেল।,16,77,2
"সিনেমার কালার টোন শান্ত, চোখে লাগার মতো কিছু নেই।",9,49,0
"সিনেমায় চরিত্রগুলোর সম্পর্ক সাধারণভাবে দেখানো হয়েছে, খুব বেশি আবেগপূর্ণ নয়।",10,78,0
"সামাজিক বার্তা খুব বড় কিছু না, হালকা ভাবে আছে।",9,46,0
"গল্পের থিম পরিষ্কার, তবে বেশি আকর্ষণ নেই।",7,41,0
গল্পটি সহজ হলেও বার্তাটি শক্তিশালী এবং ইতিবাচক।,7,47,0
সেট ও লাইটিং অস্পষ্ট।,4,21,1
সিনেমার লাইটিং অনেক দৃশ্যে চোখে কষ্ট দেয়।,7,41,0
কিরে ভাই। ভুতের মুভি দেখে হাসি আসে কেন,8,38,1
এই রে বাবা তোদেরকে কে বলেছে এই ইন্ডাস্ট্রিতে আসতে অভিনয় করতে আগে শিখে আয় ভালো হবে,16,83,1
"সেট ডিজাইন সাধারণ, গল্পের পরিবেশের সঙ্গে মানানসই।",7,49,0
সংলাপ অনেকটা বাস্তবধর্মী ছিল।,4,29,0
"সিনেমার বার্তা ঠিক আছে, তবে গভীর নয়।",7,37,0
ট্রানজিশনগুলো বেশিরভাগ জায়গায় নরমাল।,4,36,1
"কোনো বড় ভুল চোখে পড়েনি, তেমন বড় চমকও না।",9,40,1
আধুনিক বাংলা চলচ্চিত্র শুধুই বিনোদন।,5,36,2
সিনেমার প্লটটা সহজ হলেও উপস্থাপনাটা দারুণ। অভিনেতাদের সংলাপ বলার ধরন এবং এক্সপ্রেশন দেখে বারবার মনে হয়েছে তারা চরিত্রের মধ্যেই বাস করছে।,21,136,0
ভালো লাগছে বাঘের ব্যাপারে,4,25,1
যেসব বিষয়কে গুরুত্বপূর্ণ হিসেবে দেখানো হয়েছে সেগুলোরই সঠিক ব্যাখ্যা নেই।,10,74,0
"সিনেমায় হঠাৎ করে কোনো পরিবর্তন আসেনি, ধীর গতি বজায় ছিল।",10,55,0
"সিনেমার মূল বার্তাটা স্পষ্ট ছিল, তবে খুব গভীর না।",9,49,0
সিনেমার অ্যাকশন দৃশ্য খুব সাধারণ এবং উজ্জ্বলতা নেই।,8,51,0
চরিত্রগুলোর অভিনয় প্রায়শই অপ্রাকৃতিক এবং অসংলগ্ন।,6,51,0
কোনো দৃশ্যেই তেমন আবেগ অনুভব হয় না।,7,36,0
"অভিনেতা-অভিনেত্রীরা সঠিকভাবে ডায়লগ দিয়েছে, তবে প্রাণ ছিল কম।",9,62,0
কালার টোন কিছুক্ষেত্রে সুন্দর লাগলেও সব দৃশ্যে একরকম লাগে নি।,10,61,0
"ফাইনাল রেজোলিউশনটা সহজ ছিল, বেশি জটিল করা হয়নি।",8,48,0
"গল্পের গতি মাঝারি—না ধীর, না দ্রুত।",7,35,0
হাইস্বকর অভিনয় এবং কাহিনি,4,25,1
আমি টেনেটুনে দুই মিনিটের নিচে শেষ করছি। এত সুন্দর ছবি আর নেই। তাই তাড়াতাড়ি শেষ করছি,16,85,1
"বন্ধুত্ব,প্রেম,মাতৃত্ব - জীবনের বিভিন্ন অনুভূতির মিশ্রনে একটি অসাধারণ বাংলা ছবি। প্রতিটি শিল্পীর সাবলীল অভিনয় , সুন্দর পরিচালন, মনোমুগ্ধকর সঙ্গীত আর সর্বোপরি শ্রদ্ধেয় সৌমিত্র চট্টোপাধ্যায়ের অপরূপ অভিনয় ও কবিতা পাঠ এই ছবিটিকে নিঃসন্দেহে এক বিশেষ পর্যায়ে উন্নীত করেছে।",37,271,2
সিনেমার শিরোনাম গল্পের সাথে সামঞ্জস্যপূর্ণ কিন্তু আকর্ষণীয় নয়।,8,64,0
গানগুলো সিনেমার পরিস্থিতির সঙ্গে মানানসই ছিল।,6,45,0
"সিনেমার প্লট ধারণা অনুযায়ী চলেছে, কোনো চমক দেয়নি।",8,49,0
সিনেমার একাধিক দৃশ্য একই ধরনের ছিল।,6,35,0
এদের যে কি হবে রে বাবা আর হচ্ছে না আর পারছি না এদেরকে,13,53,1
আমি খুবই আগ্রহ নিয়ে মুভিটা দেখছিলাম তবে যে শিক্ষা পেলাম আর না,12,62,2
"সিনেমার বার্তা বোঝা সহজ, তবে নতুনত্ব নেই।",7,41,0
সিনেমার অ্যাকশন দৃশ্য উত্তেজনাপূর্ণ।,4,36,0
আহা কোন অশ্লীলতা ছাড়া সিনেমাটি কত সুন্দর!,7,42,2
অনেক ভালো লাগছে,3,15,1
বাজে ছেলে না।তার চেড়া ছেলে।কি বলে এগুলাকে ছবি করতে।লেজ সোজা করে এখনো কথা বলতে পারেনা,18,85,1
ছবিটা ইতিহাস হয়ে থাকবে আজীবন,5,28,2
অনেক সুন্দরী পরীমনি অভিনয় খুব ভালো করেন,7,39,1
কিছু দৃশ্য খুব ধীরে এগোচ্ছে মনে হয়েছে।,7,39,0
চরিত্রগুলো খুবই রিয়েল মনে হয়েছে।,5,32,0
সিনেমার মোড় ঘোরা দৃশ্যগুলো অনুপস্থিত ছিল।,6,41,0
নায়িকার হাসির ওপর ক্রাশ,4,23,1
অসাধারণ একটি সিনেমা,3,19,2
ক্যামেরার অসংলগ্ন অ্যাঙ্গেল অনেক জায়গায় দৃশ্যগুলোকে বিরক্তিকর করে তুলেছে।,9,75,1
ক্যামেরার কাজ এত ভালো যে প্রতিটি শটের ভিজ্যুয়াল আলাদা সৌন্দর্য বহন করে।,12,72,1
সিনেমার পারফরম্যান্স খুব নিরপেক্ষ।,4,34,0
এই আধুনিক যুগে আমি এই যুগের মেয়ে হয়ে ও এইসব ছবি দেখতে ভালো লাগে। আজ এই ছবি দেখে প্রচুর কান্নাও করেছি,21,100,2
"কিছু ভুল আর ভুল বুঝাবুঝি একটি সংসারকে অশান্তি এনে দেয়,এসব মেনে আমাদের মানব জীবন গড়ে তোলা উচিত। ছবির গল্পটা খুব সুন্দর।",22,118,1
সুস্থ মানুষ কখনোই এই সমস্ত ছবি দেখবে না যেহেতু বাপ্পি আছে,11,57,1
হাস্যরস এবং নাটকীয়তা খুব ভালোভাবে ব্যালান্স করা হয়েছে।,8,56,0
এই ছবিতে হিরোইন ভালো লাগে না,6,28,1
গানগুলো মন ছুয়ে যাবে,4,20,1
এটা কোনো ছবি হয়েছে।,4,19,2
গান আর গল্প দুটোই সুন্দর।,5,25,0
সিনেমার গল্পটা খুব একটা নতুন না হলেও বুঝতে কোনো অসুবিধা হয়নি। সবকিছু সাধারণভাবে উপস্থাপন করা হয়েছে।,16,99,0
নায়িকার জায়গায় মাহিয়া মাহি থাকলে আরও সুন্দর হতো,8,47,1
মাগা অনন্ত জলিল,3,15,1
"গল্প যে থিমে শুরু হয়েছিল, শেষে গিয়ে তা সম্পূর্ণ ভুল পথে চলে যায়।",13,66,0
ছবির কোনো বিশেষ মুহূর্ত খুব আলাদা মনে হয়নি।,8,43,0
ফিল্মের সেট ডিজাইন ভালো হলেও বাস্তবতার অভাব ছিল।,8,48,0
"সিনেমার সময়কাল একটু বেশি লেগেছে, তবে সহ্য করা গেছে।",9,52,0
গল্পে যুক্তি খুঁজতে গেলে পুরো সিনেমার কাঠামোই ভেঙে পড়ে।,9,56,0
"সিনেমার বার্তা পরিষ্কার, তবে কিছু অংশে অতিরিক্ত তথ্য দেওয়া হয়েছে যা গল্পের সঙ্গে তেমন মানায় না।",16,98,0
সংলাপগুলো এমনভাবে লেখা যেন পুরনো সিরিয়াল থেকে তুলে আনা।,9,56,1
কোন চরিত্রটা আসলে গুরুত্বপূর্ণ—এটা বোঝতেই সময় নষ্ট হয়েছে।,9,59,1
"গল্পটা কিছুটা প্রেডিক্টেবল ছিল, কিন্তু উপস্থাপন ভদ্রস্থ।",7,56,0
"গল্পে নতুনত্ব নেই, তবে দেখার সময় সমস্যা হয়নি। সংলাপ ও চরিত্র ঠিক আছে, মিউজিক গল্পের সঙ্গে মানানসই।",17,100,0
মিউজিক গল্পের সাথে মিলছে না।,5,28,0
! কি আর বলব এই পাগলা বাংলাদেশটাকে,6,33,1
শুরু থেকে শেষ পর্যন্ত গতিটা প্রায় একরকম ছিল।,8,45,0
এক কথায় অসাধারণ,3,15,1
চরিত্রের পোশাক ও সেট ডিজাইন সাধারণ মানের।,7,41,0
সুন্দর ছবির মতো সুন্দর ছবির গানও খুব ভালো।,8,42,2
ব্যাকগ্রাউন্ড স্কোর গল্পের আবহকে সমর্থন করেছে।,6,46,1
সিনেমার ভিজ্যুয়াল টোন মনোমুগ্ধকর নয়।,5,38,0
ভিজ্যুয়াল এবং ব্যাকগ্রাউন্ড স্কোর গল্পের সঙ্গে যথাযথভাবে মানানসই।,8,66,1
আমার জীবনে দেখা সেরা ছবি মান্না ভাই আপনি একজন লিজেন্ড। বাংলা চলচিত্রে একজন ই মান্না ছিলো।,16,89,1
সিনেমার থিম দুর্বল এবং বার্তা অসম্পূর্ণ।,6,40,0
অভিনয় ভালো হলেও স্ক্রিনপ্লেতে আলাদা কিছু ছিল না।,8,49,0
"সিনেমায় কোনো বিশেষ বার্তা ছিল না, শুধু একটানা একটি কাহিনি।",10,58,0
গল্পের টার্নিং পয়েন্টগুলো খুব বড় না।,6,38,0
আমি একটি সুন্দর ছবি দেখেছি। সত্যজিৎ রায়ের সৃষ্টি অবশ্যই এরকম। অনুপকুমার এবং সব্যসাচীর অভিনয় অনবদ্য।,15,101,2
"গানের সংখ্যা কম, যা আছে তা গল্পকে বাধা দেয়নি।",9,46,0
লোকেশনগুলো গল্পকে যথেষ্ট সাপোর্ট দিয়েছে।,5,40,0
"সিনেমার কিছু অংশ ভালো ছিল, কিছু অংশ খুবই সাধারণ।",9,48,0
আমি মনে করি অনন্ত জলিল একজন মহান নায়ক,8,38,1
অসম্ভব কে সম্ভব করে অভিনয়টা কে শিখতে হবে অন্তত সাহেব,10,52,1
এই হোলো নারী স্বাধীনতা। যেখানে মা ছেলেকে চেনেনা। হা হা হা। ভারত রে ভারত।,14,72,1
"গল্প সরল, বিশেষ কোনো চমক নেই। সিনেমার টেম্পো মাঝে মাঝে ধীর, চরিত্রগুলো ঠিক আছে। মিউজিক এবং প্রোডাকশন মান ঠিকঠাক। সংলাপ স্বাভাবিক।",21,129,0
পরিচালক পেলেন না নায়ক,4,22,1
সিনেমার প্রেক্ষাপট শহর কেন্দ্রিক হলেও আলাদা কিছু মনে হয়নি।,9,58,0
বাংলা চলচ্চিত্রের পর্দায় যতগুলো চলচ্চিত্র নির্মিত হয়েছে তার মধ্যে বেদের কন্যা জ্যোৎস্না অন্যতম বিখ্যাত। কালের বিবর্তনে আজ এই চলচ্চিত্রগুলো হারিয়ে গেলেও হাজার বছর পরেও এই চলচ্চিত্রগুলোর বাস্তব অভিনয় সকলের হৃদয়ে গেঁথে থাকবে।,32,227,1
সিনেমার লাইটিং অনেক ক্ষেত্রে অস্বাভাবিক ও অপ্রাকৃতিক।,7,53,0
"মুভিটা অনেক লম্বা লাগছিল, কাটছাঁট করলে ভাল হতো।",8,47,2
"সিনেমার শুরু আকর্ষণীয়, কিন্তু মাঝের অংশে কিছুটা ধীর মনে হয়েছে। চরিত্র বিকাশ মাঝারি, সংলাপ স্বাভাবিক। একবার দেখার মতো।",18,119,0
মুভিটা মোটামুটি সময় কেটে যাওয়ার মতো।,6,38,2
এর থেকে বাজে ছবি আর হয় না,7,25,1
পোস্টারের তুলনায় সিনেমার টোন একটু ভিন্ন মনে হয়েছে।,8,52,0
"সিনেমার কিছু অংশ ঠিকঠাক, কিছু কিছু দৃশ্য অপ্রয়োজনীয় মনে হয়েছে।",10,63,0
এট মুভিটা আজকে প্রথম দেখলাম। মুক্তিযোদ্ধাদের প্রতি ভালোবাসা টা আরো বেরে গেল,12,75,2
গানের সময় নির্বাচন এতই বেমানান যে গল্পের পরিবেশ পুরো ভেঙে দেয়।,11,64,0
"সিনেমার ভাষা সহজবোধ্য ছিল, কঠিন কিছু ছিল না।",8,44,0
"ওহ মাই গড, বাংলাদেশে এমন সিনেমা হয় জানতাম না।",9,46,2
"সিনেমার শুরুর দিকটা ভালো, শেষে কিছুটা হঠাৎ।",7,43,0
"মুভির রিদম একেবারেই প্রাকৃতিক, গল্পের সাথে ব্যাকগ্রাউন্ড মিউজিক পুরোপুরি মানিয়েছে। চরিত্রগুলোর এক্সপ্রেশন এবং সংলাপ এত বাস্তব যে দর্শক সহজেই আবেগে যুক্ত হয়। সিনেমার লোকেশন, সেট ডিজাইন এবং লাইটিং গল্পের আবহকে আরও প্রাণবন্ত করেছে।",33,230,0
হাতি আর মশার ভালোবাসা,4,21,1
সংলাপ এবং মিউজিক একত্রে দর্শকের আবেগকে বাড়িয়ে দিয়েছে।,8,56,0
গল্পটা অনেকটা প্রেডিক্টেবল ছিল।,4,31,0
"সিনেমার ভিজ্যুয়াল ঠিক ছিল, কিন্তু আবেগের দিকটা দুর্বল।",8,55,0
"সিনেমাটা খুব সিরিয়াস না, আবার খুব হালকাও না—মাঝামাঝি।",9,54,0
একটা ভাল মনের মানুষ না হলে এমন সিনেমা বানাতে পারে না এমন সিনেমা খারাপ মানুষ গুলোর জন্য একটি মেসেজ ধন্যবাদ পরিচালক কে,22,116,1
"সেট ডিজাইন সাধারণ, খুব বড়ো নয়, তবে গল্পের পরিবেশের সঙ্গে মানানসই।",11,67,0
"খুব কম আবেগ পুরো সিনেমা জুড়ে কাজ করেছে, কিন্তু এটা একঘেয়ে ছিল না.",13,67,0
এই মুভিটা তেলেগু সিনেমা বোমারিলু থেকে কপি করা,8,45,1
অসাধারণ একটি মুভি,3,17,2
বেশ মজার বই অসাধারণ অভিনয়,5,25,1
কি চমৎকার একটা মুভি। শুরু থেকেই কাহিনি বুঝতে পারলাম,9,51,2
"না তো ভালো অভিনয় আছে, ভালো ডায়লগ। না তো তার কন্ঠস্বর। যেন মঞ্চে যাত্রা পালা হচ্ছে। যাত্রাপালা বললেও গ্রামবাংলার ঐতিহ্যগত যাত্রাপালারও অপমান হবে।",23,144,1
"ছবির মধ্যে বার্তা ছিল, কিন্তু সেটা খুব জোরালো ছিল না।",10,53,0
আচলকে কেন সিনেমা তে নেয়া হলো।অভিনয় পারে না।এক্সপ্রেসনলেস,10,56,1
"সিনেমার টোন শান্ত এবং স্থির, কোনো হঠাৎ উত্তেজনা বা চমক নেই।",11,59,0
আমার জীবনের দেখা সবচেয়ে নিখুঁত একটা সিনেনা,7,42,1
গল্পের সেটআপ সহজ।,3,17,0
